section_count,section,label,section_cutci,section_cutzi
1,在中国文学文学史中认为陈忱后水浒水浒传写李俊等到海外为王是受了虬髯客传的影响颇有见地然而他说虬髯客传是一篇荒唐不经的道士气息很重的传奇文以荒唐不经四字来评论这唐代第一一篇第一篇短篇小说短篇小说胡适的意见读文学而去注重故事的是否真实完全不珍视它的文学价值也未免有些荒唐不经了历史上的名将当然总是胜多败少但李靖一生似乎从未打过败仗那确是古今中外古今中外极罕有的事可是他一生之中也遇过二次大险第一一次第一次他还在隋朝小官做小官发觉李渊有造反的迹象便要到江都去向炀帝隋炀帝告发因道路不通而止李渊取得长安后捉住了李靖要斩李靖大叫公起义兵本为天下除暴乱不欲就大事而以私怨斩壮士乎李渊觉得他言词很有气概世民李世民又代为代为说项于是饶了他这是正史上所记载李靖结识追随世民李世民的开始李渊做皇帝后派李靖攻萧铣因兵少而无进展李渊还记着他当年要告发自己造反的旧怨暗下命令叫峡州都督许绍杀了他许绍知道李靖有才能极力代为求情不久李靖以八百兵大破冉肇则俘虏五千千余五千余人李渊大喜对众公卿说不如使功不如使过这一次做对了有功的人恃功而骄往往误事而存心赎罪之人小心谨慎小心谨慎全力全力以赴成功的机会反大那便是所谓不如使功不如使过李渊于是亲笔亲笔写了一封敕书给李靖说既往既往不咎旧事吾久忘之矣其实说久忘之矣毕竟还是不忘不过只不过郑重声明郑重声明以后不再计较而已所以在慰劳他的文书中说卿竭诚尽力功效特彰远览至诚极以嘉赏勿忧富贵也但最危险的一次还是在他大破突厥之后突厥是唐朝的大敌武力十分强盛李渊初起兵时不得不得不向之称臣唐朝君臣都引为奇耻大辱世民李世民削平群雄统一一天天下统一天下突厥却一再来犯有一次一直攻到京城之外的渭水边世民李世民只得干冒大险亲自出马亲自出马与之结盟李靖居然将之打得不振一蹶不振全国上下全国上下的兴奋可想可想而知当时太宗大喜之下大赦天下大赦天下下旨遍赐百姓酒肉全国狂欢五日李靖立下这样的大功班师班师回班师回朝哪知御史大夫史大夫御史大夫立即就弹劾他罪名是军无纲纪致令虏中奇宝散于乱兵之手这实在是个莫名莫名其妙的罪名太宗却对李靖大加责备李靖很是聪明知道自己立功太大皇帝内心一定不喜欢御史大夫史大夫御史大夫的,三十三剑客图,在 中国 文学 文学史 中 认为 陈忱 后 水浒 水浒传 写 李俊 等到 海外 为 王 是 受 了 虬髯 客传 的 影响 颇 有 见 地 然而 他 说 虬髯 客传 是 一篇 荒唐 不经 的 道士 气息 很重 的 传奇 文 以 荒唐 不 经 四字来 评论 这 唐代 第一 一篇 第一篇 短篇 小说 短篇小说 胡适 的 意见 读 文学 而 去 注重 故事 的 是否 真实 完全 不 珍视 它 的 文学 价值 也 未免 有些 荒唐 不 经 了 历史 上 的 名将 当然 总是 胜多败 少 但 李靖 一生 似乎 从未 打 过 败仗 那确 是 古今 中外 古今中外 极 罕有 的 事 可是 他 一生 之中 也 遇过 二次 大险 第一 一次 第一次 他 还 在 隋朝 小官 做小官 发觉 李渊 有 造反 的 迹象 便 要 到 江都 去向 炀帝 隋炀帝 告发 因 道路 不通 而止 李渊 取得 长安 后 捉住 了 李靖 要 斩 李靖 大叫 公 起义 兵 本为 天下 除 暴乱 不欲 就 大事 而 以 私怨 斩 壮士 乎 李渊 觉得 他 言词 很 有 气概 世民 李世民 又 代为 代为说项 于是 饶 了 他 这是 正史 上 所 记载 李靖 结识 追随 世民 李世民 的 开始 李渊 做 皇帝 后 派 李靖 攻萧 铣 因兵 少 而 无 进展 李渊 还记 着 他 当年 要 告发 自己 造反 的 旧怨 暗下 命令 叫峡州 都督 许绍 杀 了 他 许绍 知道 李靖 有 才能 极力 代为 求情 不久 李靖 以 八百 兵大破 冉肇则 俘虏 五千 千余 五千余 人 李渊 大喜 对众 公卿 说 不如 使功不如使过 这 一次 做 对 了 有功 的 人恃功 而 骄 往往 误事 而 存心 赎罪 之 人 小心 谨慎 小心谨慎 全力 全力以赴 成功 的 机会 反大 那 便是 所谓 不如 使功不如使过 李渊 于是 亲笔 亲笔写 了 一封 敕书 给 李靖 说 既往 既往不咎 旧事 吾 久 忘 之 矣 其实 说 久 忘 之 矣 毕竟 还是 不 忘 不过 只不过 郑重 声明 郑重声明 以后 不再 计较 而已 所以 在 慰劳 他 的 文书 中说 卿 竭诚 尽力 功效 特彰 远览 至诚 极以 嘉赏 勿 忧 富贵 也 但 最 危险 的 一次 还是 在 他 大破 突厥 之后 突厥 是 唐朝 的 大敌 武力 十分 强盛 李渊 初 起兵 时 不得 不得不 向 之 称臣 唐朝 君臣 都 引为 奇耻大辱 世民 李世民 削平 群雄 统一 一天 天下 统一天下 突厥 却 一再 来犯 有 一次 一直 攻 到 京城 之外 的 渭水 边 世民 李世民 只得 干 冒 大险 亲自 出马 亲自出马 与 之 结盟 李靖 居然 将 之 打 得 不振 一蹶不振 全国 上下 全国上下 的 兴奋 可想 可想而知 当时 太宗 大喜 之下 大赦 天下 大赦天下 下旨 遍 赐 百姓 酒肉 全国 狂欢 五日 李靖 立下 这样 的 大功 班师 班师回 班师回朝 哪知 御史 大夫 史大夫 御史大夫 立即 就 弹劾 他 罪名 是 军无 纲纪 致令虏 中奇宝 散于 乱兵 之手 这 实在 是 个 莫名 莫名其妙 的 罪名 太宗 却 对 李靖 大加 责备 李靖 很 是 聪明 知道 自己 立功 太 大 皇帝 内心 一定 不 喜欢 御史 大夫 史大夫 御史大夫 的 ,在 中 国 文 学 文 学 史 中 认 为 陈 忱 后 水 浒 水 浒 传 写 李 俊 等 到 海 外 为 王 是 受 了 虬 髯 客 传 的 影 响 颇 有 见 地 然 而 他 说 虬 髯 客 传 是 一 篇 荒 唐 不 经 的 道 士 气 息 很 重 的 传 奇 文 以 荒 唐 不 经 四 字 来 评 论 这 唐 代 第 一 一 篇 第 一 篇 短 篇 小 说 短 篇 小 说 胡 适 的 意 见 读 文 学 而 去 注 重 故 事 的 是 否 真 实 完 全 不 珍 视 它 的 文 学 价 值 也 未 免 有 些 荒 唐 不 经 了 历 史 上 的 名 将 当 然 总 是 胜 多 败 少 但 李 靖 一 生 似 乎 从 未 打 过 败 仗 那 确 是 古 今 中 外 古 今 中 外 极 罕 有 的 事 可 是 他 一 生 之 中 也 遇 过 二 次 大 险 第 一 一 次 第 一 次 他 还 在 隋 朝 小 官 做 小 官 发 觉 李 渊 有 造 反 的 迹 象 便 要 到 江 都 去 向 炀 帝 隋 炀 帝 告 发 因 道 路 不 通 而 止 李 渊 取 得 长 安 后 捉 住 了 李 靖 要 斩 李 靖 大 叫 公 起 义 兵 本 为 天 下 除 暴 乱 不 欲 就 大 事 而 以 私 怨 斩 壮 士 乎 李 渊 觉 得 他 言 词 很 有 气 概 世 民 李 世 民 又 代 为 代 为 说 项 于 是 饶 了 他 这 是 正 史 上 所 记 载 李 靖 结 识 追 随 世 民 李 世 民 的 开 始 李 渊 做 皇 帝 后 派 李 靖 攻 萧 铣 因 兵 少 而 无 进 展 李 渊 还 记 着 他 当 年 要 告 发 自 己 造 反 的 旧 怨 暗 下 命 令 叫 峡 州 都 督 许 绍 杀 了 他 许 绍 知 道 李 靖 有 才 能 极 力 代 为 求 情 不 久 李 靖 以 八 百 兵 大 破 冉 肇 则 俘 虏 五 千 千 余 五 千 余 人 李 渊 大 喜 对 众 公 卿 说 不 如 使 功 不 如 使 过 这 一 次 做 对 了 有 功 的 人 恃 功 而 骄 往 往 误 事 而 存 心 赎 罪 之 人 小 心 谨 慎 小 心 谨 慎 全 力 全 力 以 赴 成 功 的 机 会 反 大 那 便 是 所 谓 不 如 使 功 不 如 使 过 李 渊 于 是 亲 笔 亲 笔 写 了 一 封 敕 书 给 李 靖 说 既 往 既 往 不 咎 旧 事 吾 久 忘 之 矣 其 实 说 久 忘 之 矣 毕 竟 还 是 不 忘 不 过 只 不 过 郑 重 声 明 郑 重 声 明 以 后 不 再 计 较 而 已 所 以 在 慰 劳 他 的 文 书 中 说 卿 竭 诚 尽 力 功 效 特 彰 远 览 至 诚 极 以 嘉 赏 勿 忧 富 贵 也 但 最 危 险 的 一 次 还 是 在 他 大 破 突 厥 之 后 突 厥 是 唐 朝 的 大 敌 武 力 十 分 强 盛 李 渊 初 起 兵 时 不 得 不 得 不 向 之 称 臣 唐 朝 君 臣 都 引 为 奇 耻 大 辱 世 民 李 世 民 削 平 群 雄 统 一 一 天 天 下 统 一 天 下 突 厥 却 一 再 来 犯 有 一 次 一 直 攻 到 京 城 之 外 的 渭 水 边 世 民 李 世 民 只 得 干 冒 大 险 亲 自 出 马 亲 自 出 马 与 之 结 盟 李 靖 居 然 将 之 打 得 不 振 一 蹶 不 振 全 国 上 下 全 国 上 下 的 兴 奋 可 想 可 想 而 知 当 时 太 宗 大 喜 之 下 大 赦 天 下 大 赦 天 下 下 旨 遍 赐 百 姓 酒 肉 全 国 狂 欢 五 日 李 靖 立 下 这 样 的 大 功 班 师 班 师 回 班 师 回 朝 哪 知 御 史 大 夫 史 大 夫 御 史 大 夫 立 即 就 弹 劾 他 罪 名 是 军 无 纲 纪 致 令 虏 中 奇 宝 散 于 乱 兵 之 手 这 实 在 是 个 莫 名 莫 名 其 妙 的 罪 名 太 宗 却 对 李 靖 大 加 责 备 李 靖 很 是 聪 明 知 道 自 己 立 功 太 大 皇 帝 内 心 一 定 不 喜 欢 御 史 大 夫 史 大 夫 御 史 大 夫 的 
1,在中国文学文学史中认为陈忱后水浒水浒传写李俊等到海外为王是受了虬髯客传的影响颇有见地然而他说虬髯客传是一篇荒唐不经的道士气息很重的传奇文以荒唐不经四字来评论这唐代第一一篇第一篇短篇小说短篇小说胡适的意见读文学而去注重故事的是否真实完全不珍视它的文学价值也未免有些荒唐不经了历史上的名将当然总是胜多败少但李靖一生似乎从未打过败仗那确是古今中外古今中外极罕有的事可是他一生之中也遇过二次大险第一一次第一次他还在隋朝小官做小官发觉李渊有造反的迹象便要到江都去向炀帝隋炀帝告发因道路不通而止李渊取得长安后捉住了李靖要斩李靖大叫公起义兵本为天下除暴乱不欲就大事而以私怨斩壮士乎李渊觉得他言词很有气概世民李世民又代为代为说项于是饶了他这是正史上所记载李靖结识追随世民李世民的开始李渊做皇帝后派李靖攻萧铣因兵少而无进展李渊还记着他当年要告发自己造反的旧怨暗下命令叫峡州都督许绍杀了他许绍知道李靖有才能极力代为求情不久李靖以八百兵大破冉肇则俘虏五千千余五千余人李渊大喜对众公卿说不如使功不如使过这一次做对了有功的人恃功而骄往往误事而存心赎罪之人小心谨慎小心谨慎全力全力以赴成功的机会反大那便是所谓不如使功不如使过李渊于是亲笔亲笔写了一封敕书给李靖说既往既往不咎旧事吾久忘之矣其实说久忘之矣毕竟还是不忘不过只不过郑重声明郑重声明以后不再计较而已所以在慰劳他的文书中说卿竭诚尽力功效特彰远览至诚极以嘉赏勿忧富贵也但最危险的一次还是在他大破突厥之后突厥是唐朝的大敌武力十分强盛李渊初起兵时不得不得不向之称臣唐朝君臣都引为奇耻大辱世民李世民削平群雄统一一天天下统一天下突厥却一再来犯有一次一直攻到京城之外的渭水边世民李世民只得干冒大险亲自出马亲自出马与之结盟李靖居然将之打得不振一蹶不振全国上下全国上下的兴奋可想可想而知当时太宗大喜之下大赦天下大赦天下下旨遍赐百姓酒肉全国狂欢五日李靖立下这样的大功班师班师回班师回朝哪知御史大夫史大夫御史大夫立即就弹劾他罪名是军无纲纪致令虏中奇宝散于乱兵之手这实在是个莫名莫名其妙的罪名太宗却对李靖大加责备李靖很是聪明知道自己立功太大皇帝内心一定不喜欢御史大夫史大夫御史大夫的,三十三剑客图,在 中国 文学 文学史 中 认为 陈忱 后 水浒 水浒传 写 李俊 等到 海外 为 王 是 受 了 虬髯 客传 的 影响 颇 有 见 地 然而 他 说 虬髯 客传 是 一篇 荒唐 不经 的 道士 气息 很重 的 传奇 文 以 荒唐 不 经 四字来 评论 这 唐代 第一 一篇 第一篇 短篇 小说 短篇小说 胡适 的 意见 读 文学 而 去 注重 故事 的 是否 真实 完全 不 珍视 它 的 文学 价值 也 未免 有些 荒唐 不 经 了 历史 上 的 名将 当然 总是 胜多败 少 但 李靖 一生 似乎 从未 打 过 败仗 那确 是 古今 中外 古今中外 极 罕有 的 事 可是 他 一生 之中 也 遇过 二次 大险 第一 一次 第一次 他 还 在 隋朝 小官 做小官 发觉 李渊 有 造反 的 迹象 便 要 到 江都 去向 炀帝 隋炀帝 告发 因 道路 不通 而止 李渊 取得 长安 后 捉住 了 李靖 要 斩 李靖 大叫 公 起义 兵 本为 天下 除 暴乱 不欲 就 大事 而 以 私怨 斩 壮士 乎 李渊 觉得 他 言词 很 有 气概 世民 李世民 又 代为 代为说项 于是 饶 了 他 这是 正史 上 所 记载 李靖 结识 追随 世民 李世民 的 开始 李渊 做 皇帝 后 派 李靖 攻萧 铣 因兵 少 而 无 进展 李渊 还记 着 他 当年 要 告发 自己 造反 的 旧怨 暗下 命令 叫峡州 都督 许绍 杀 了 他 许绍 知道 李靖 有 才能 极力 代为 求情 不久 李靖 以 八百 兵大破 冉肇则 俘虏 五千 千余 五千余 人 李渊 大喜 对众 公卿 说 不如 使功不如使过 这 一次 做 对 了 有功 的 人恃功 而 骄 往往 误事 而 存心 赎罪 之 人 小心 谨慎 小心谨慎 全力 全力以赴 成功 的 机会 反大 那 便是 所谓 不如 使功不如使过 李渊 于是 亲笔 亲笔写 了 一封 敕书 给 李靖 说 既往 既往不咎 旧事 吾 久 忘 之 矣 其实 说 久 忘 之 矣 毕竟 还是 不 忘 不过 只不过 郑重 声明 郑重声明 以后 不再 计较 而已 所以 在 慰劳 他 的 文书 中说 卿 竭诚 尽力 功效 特彰 远览 至诚 极以 嘉赏 勿 忧 富贵 也 但 最 危险 的 一次 还是 在 他 大破 突厥 之后 突厥 是 唐朝 的 大敌 武力 十分 强盛 李渊 初 起兵 时 不得 不得不 向 之 称臣 唐朝 君臣 都 引为 奇耻大辱 世民 李世民 削平 群雄 统一 一天 天下 统一天下 突厥 却 一再 来犯 有 一次 一直 攻 到 京城 之外 的 渭水 边 世民 李世民 只得 干 冒 大险 亲自 出马 亲自出马 与 之 结盟 李靖 居然 将 之 打 得 不振 一蹶不振 全国 上下 全国上下 的 兴奋 可想 可想而知 当时 太宗 大喜 之下 大赦 天下 大赦天下 下旨 遍 赐 百姓 酒肉 全国 狂欢 五日 李靖 立下 这样 的 大功 班师 班师回 班师回朝 哪知 御史 大夫 史大夫 御史大夫 立即 就 弹劾 他 罪名 是 军无 纲纪 致令虏 中奇宝 散于 乱兵 之手 这 实在 是 个 莫名 莫名其妙 的 罪名 太宗 却 对 李靖 大加 责备 李靖 很 是 聪明 知道 自己 立功 太 大 皇帝 内心 一定 不 喜欢 御史 大夫 史大夫 御史大夫 的 ,在 中 国 文 学 文 学 史 中 认 为 陈 忱 后 水 浒 水 浒 传 写 李 俊 等 到 海 外 为 王 是 受 了 虬 髯 客 传 的 影 响 颇 有 见 地 然 而 他 说 虬 髯 客 传 是 一 篇 荒 唐 不 经 的 道 士 气 息 很 重 的 传 奇 文 以 荒 唐 不 经 四 字 来 评 论 这 唐 代 第 一 一 篇 第 一 篇 短 篇 小 说 短 篇 小 说 胡 适 的 意 见 读 文 学 而 去 注 重 故 事 的 是 否 真 实 完 全 不 珍 视 它 的 文 学 价 值 也 未 免 有 些 荒 唐 不 经 了 历 史 上 的 名 将 当 然 总 是 胜 多 败 少 但 李 靖 一 生 似 乎 从 未 打 过 败 仗 那 确 是 古 今 中 外 古 今 中 外 极 罕 有 的 事 可 是 他 一 生 之 中 也 遇 过 二 次 大 险 第 一 一 次 第 一 次 他 还 在 隋 朝 小 官 做 小 官 发 觉 李 渊 有 造 反 的 迹 象 便 要 到 江 都 去 向 炀 帝 隋 炀 帝 告 发 因 道 路 不 通 而 止 李 渊 取 得 长 安 后 捉 住 了 李 靖 要 斩 李 靖 大 叫 公 起 义 兵 本 为 天 下 除 暴 乱 不 欲 就 大 事 而 以 私 怨 斩 壮 士 乎 李 渊 觉 得 他 言 词 很 有 气 概 世 民 李 世 民 又 代 为 代 为 说 项 于 是 饶 了 他 这 是 正 史 上 所 记 载 李 靖 结 识 追 随 世 民 李 世 民 的 开 始 李 渊 做 皇 帝 后 派 李 靖 攻 萧 铣 因 兵 少 而 无 进 展 李 渊 还 记 着 他 当 年 要 告 发 自 己 造 反 的 旧 怨 暗 下 命 令 叫 峡 州 都 督 许 绍 杀 了 他 许 绍 知 道 李 靖 有 才 能 极 力 代 为 求 情 不 久 李 靖 以 八 百 兵 大 破 冉 肇 则 俘 虏 五 千 千 余 五 千 余 人 李 渊 大 喜 对 众 公 卿 说 不 如 使 功 不 如 使 过 这 一 次 做 对 了 有 功 的 人 恃 功 而 骄 往 往 误 事 而 存 心 赎 罪 之 人 小 心 谨 慎 小 心 谨 慎 全 力 全 力 以 赴 成 功 的 机 会 反 大 那 便 是 所 谓 不 如 使 功 不 如 使 过 李 渊 于 是 亲 笔 亲 笔 写 了 一 封 敕 书 给 李 靖 说 既 往 既 往 不 咎 旧 事 吾 久 忘 之 矣 其 实 说 久 忘 之 矣 毕 竟 还 是 不 忘 不 过 只 不 过 郑 重 声 明 郑 重 声 明 以 后 不 再 计 较 而 已 所 以 在 慰 劳 他 的 文 书 中 说 卿 竭 诚 尽 力 功 效 特 彰 远 览 至 诚 极 以 嘉 赏 勿 忧 富 贵 也 但 最 危 险 的 一 次 还 是 在 他 大 破 突 厥 之 后 突 厥 是 唐 朝 的 大 敌 武 力 十 分 强 盛 李 渊 初 起 兵 时 不 得 不 得 不 向 之 称 臣 唐 朝 君 臣 都 引 为 奇 耻 大 辱 世 民 李 世 民 削 平 群 雄 统 一 一 天 天 下 统 一 天 下 突 厥 却 一 再 来 犯 有 一 次 一 直 攻 到 京 城 之 外 的 渭 水 边 世 民 李 世 民 只 得 干 冒 大 险 亲 自 出 马 亲 自 出 马 与 之 结 盟 李 靖 居 然 将 之 打 得 不 振 一 蹶 不 振 全 国 上 下 全 国 上 下 的 兴 奋 可 想 可 想 而 知 当 时 太 宗 大 喜 之 下 大 赦 天 下 大 赦 天 下 下 旨 遍 赐 百 姓 酒 肉 全 国 狂 欢 五 日 李 靖 立 下 这 样 的 大 功 班 师 班 师 回 班 师 回 朝 哪 知 御 史 大 夫 史 大 夫 御 史 大 夫 立 即 就 弹 劾 他 罪 名 是 军 无 纲 纪 致 令 虏 中 奇 宝 散 于 乱 兵 之 手 这 实 在 是 个 莫 名 莫 名 其 妙 的 罪 名 太 宗 却 对 李 靖 大 加 责 备 李 靖 很 是 聪 明 知 道 自 己 立 功 太 大 皇 帝 内 心 一 定 不 喜 欢 御 史 大 夫 史 大 夫 御 史 大 夫 的 
